<?xml version="1.0" encoding="UTF-8"?>
<books lastUpdated="2018-03-07" xmlns="http://www.example.org/books" 
xmlns:xsi="http://www.w3.org/2001/XMLSchema-instance"
xsi:schemaLocation="http://www.example.org/books books.xsd ">
	<book myid="b1">
	  	<title>Book1</title>
	  	<price>100</price>
	  	<author>Bob</author>
	  	<author>Sue</author>
	</book>
	<book myid="b2">
		<title>Book2</title>
		<price>100.00</price>
		<author>Arnold</author>
	</book>
	<author>
		<name>Bob</name>
		<work>b1</work>
	</author>
</books>
